{"$schema":"http://json-schema.org/draft-07/schema#","title":"Digital Twin Definition Language Schema - Version 4","description":"JSON Schema for validating DTDL v4 documents","type":"object","required":["@context","@id","@type"],"properties":{"@context":{"description":"The context to use when processing this Interface","oneOf":[{"type":"string","const":"dtmi:dtdl:context;4"},{"type":"array","items":{"type":"string"},"minItems":1}]},"@id":{"description":"An identifier for the Interface","type":"string","pattern":"^dtmi:[A-Za-z](?:[A-Za-z0-9_]*[A-Za-z0-9])?(?::[A-Za-z](?:[A-Za-z0-9_]*[A-Za-z0-9])?)*(?:;[1-9][0-9]{0,8}(?:\\.[1-9][0-9]{0,5})?)?$","maxLength":128},"@type":{"description":"The type of DTDL entity","type":"string","const":"Interface"},"comment":{"description":"A comment for model authors","type":"string","maxLength":512},"description":{"description":"A localizable description for display","oneOf":[{"type":"string","maxLength":512},{"type":"object","additionalProperties":{"type":"string","maxLength":512}}]},"displayName":{"description":"A localizable name for display","oneOf":[{"type":"string","maxLength":512},{"type":"object","additionalProperties":{"type":"string","maxLength":512}}]},"contents":{"description":"Elements that define the contents of this Interface","type":"array","items":{"oneOf":[{"$ref":"#/definitions/Property"},{"$ref":"#/definitions/Telemetry"},{"$ref":"#/definitions/Command"},{"$ref":"#/definitions/Relationship"},{"$ref":"#/definitions/Component"}]},"maxItems":100000},"extends":{"description":"Interfaces from which this Interface inherits contents","oneOf":[{"type":"string","pattern":"^dtmi:[A-Za-z](?:[A-Za-z0-9_]*[A-Za-z0-9])?(?::[A-Za-z](?:[A-Za-z0-9_]*[A-Za-z0-9])?)*(?:;[1-9][0-9]{0,8}(?:\\.[1-9][0-9]{0,5})?)?$"},{"type":"array","items":{"type":"string","pattern":"^dtmi:[A-Za-z](?:[A-Za-z0-9_]*[A-Za-z0-9])?(?::[A-Za-z](?:[A-Za-z0-9_]*[A-Za-z0-9])?)*(?:;[1-9][0-9]{0,8}(?:\\.[1-9][0-9]{0,5})?)?$"},"maxItems":1024}]},"schemas":{"description":"Complex schema objects that are reusable within this Interface","type":"array","items":{"oneOf":[{"$ref":"#/definitions/ArraySchema"},{"$ref":"#/definitions/EnumSchema"},{"$ref":"#/definitions/MapSchema"},{"$ref":"#/definitions/ObjectSchema"}]}}},"definitions":{"Property":{"type":"object","required":["@type","name","schema"],"properties":{"@id":{"type":"string","pattern":"^dtmi:[A-Za-z](?:[A-Za-z0-9_]*[A-Za-z0-9])?(?::[A-Za-z](?:[A-Za-z0-9_]*[A-Za-z0-9])?)*(?:;[1-9][0-9]{0,8}(?:\\.[1-9][0-9]{0,5})?)?$","maxLength":2048},"@type":{"type":"string","const":"Property"},"name":{"type":"string","pattern":"^[a-zA-Z]\\w*$","maxLength":512},"schema":{"$ref":"#/definitions/Schema"},"comment":{"type":"string","maxLength":512},"description":{"oneOf":[{"type":"string","maxLength":512},{"type":"object","additionalProperties":{"type":"string","maxLength":512}}]},"displayName":{"oneOf":[{"type":"string","maxLength":512},{"type":"object","additionalProperties":{"type":"string","maxLength":512}}]},"writable":{"type":"boolean"}}},"Telemetry":{"type":"object","required":["@type","name","schema"],"properties":{"@id":{"type":"string","pattern":"^dtmi:[A-Za-z](?:[A-Za-z0-9_]*[A-Za-z0-9])?(?::[A-Za-z](?:[A-Za-z0-9_]*[A-Za-z0-9])?)*(?:;[1-9][0-9]{0,8}(?:\\.[1-9][0-9]{0,5})?)?$","maxLength":2048},"@type":{"type":"string","const":"Telemetry"},"name":{"type":"string","pattern":"^[a-zA-Z]\\w*$","maxLength":512},"schema":{"$ref":"#/definitions/Schema"},"comment":{"type":"string","maxLength":512},"description":{"oneOf":[{"type":"string","maxLength":512},{"type":"object","additionalProperties":{"type":"string","maxLength":512}}]},"displayName":{"oneOf":[{"type":"string","maxLength":512},{"type":"object","additionalProperties":{"type":"string","maxLength":512}}]}}},"Relationship":{"type":"object","required":["@type","name"],"properties":{"@id":{"type":"string","pattern":"^dtmi:[A-Za-z](?:[A-Za-z0-9_]*[A-Za-z0-9])?(?::[A-Za-z](?:[A-Za-z0-9_]*[A-Za-z0-9])?)*(?:;[1-9][0-9]{0,8}(?:\\.[1-9][0-9]{0,5})?)?$","maxLength":2048},"@type":{"type":"string","const":"Relationship"},"name":{"type":"string","pattern":"^[a-zA-Z]\\w*$","maxLength":512},"target":{"type":"string","pattern":"^dtmi:[A-Za-z](?:[A-Za-z0-9_]*[A-Za-z0-9])?(?::[A-Za-z](?:[A-Za-z0-9_]*[A-Za-z0-9])?)*(?:;[1-9][0-9]{0,8}(?:\\.[1-9][0-9]{0,5})?)?$","maxLength":2048},"minMultiplicity":{"type":"integer","minimum":0},"maxMultiplicity":{"type":"integer","minimum":1},"properties":{"type":"array","items":{"$ref":"#/definitions/Property"}},"writable":{"type":"boolean"},"comment":{"type":"string","maxLength":512},"description":{"oneOf":[{"type":"string","maxLength":512},{"type":"object","additionalProperties":{"type":"string","maxLength":512}}]},"displayName":{"oneOf":[{"type":"string","maxLength":512},{"type":"object","additionalProperties":{"type":"string","maxLength":512}}]}}},"Component":{"type":"object","required":["@type","name","schema"],"properties":{"@id":{"type":"string","pattern":"^dtmi:[A-Za-z](?:[A-Za-z0-9_]*[A-Za-z0-9])?(?::[A-Za-z](?:[A-Za-z0-9_]*[A-Za-z0-9])?)*(?:;[1-9][0-9]{0,8}(?:\\.[1-9][0-9]{0,5})?)?$","maxLength":2048},"@type":{"type":"string","const":"Component"},"name":{"type":"string","pattern":"^[a-zA-Z]\\w*$","maxLength":512},"schema":{"type":"string","pattern":"^dtmi:[A-Za-z](?:[A-Za-z0-9_]*[A-Za-z0-9])?(?::[A-Za-z](?:[A-Za-z0-9_]*[A-Za-z0-9])?)*(?:;[1-9][0-9]{0,8}(?:\\.[1-9][0-9]{0,5})?)?$"},"comment":{"type":"string","maxLength":512},"description":{"oneOf":[{"type":"string","maxLength":512},{"type":"object","additionalProperties":{"type":"string","maxLength":512}}]},"displayName":{"oneOf":[{"type":"string","maxLength":512},{"type":"object","additionalProperties":{"type":"string","maxLength":512}}]}}},"Command":{"type":"object","required":["@type","name"],"properties":{"@id":{"type":"string","pattern":"^dtmi:[A-Za-z](?:[A-Za-z0-9_]*[A-Za-z0-9])?(?::[A-Za-z](?:[A-Za-z0-9_]*[A-Za-z0-9])?)*(?:;[1-9][0-9]{0,8}(?:\\.[1-9][0-9]{0,5})?)?$","maxLength":2048},"@type":{"type":"string","const":"Command"},"name":{"type":"string","pattern":"^[a-zA-Z]\\w*$","maxLength":512},"request":{"$ref":"#/definitions/CommandRequest"},"response":{"$ref":"#/definitions/CommandResponse"},"comment":{"type":"string","maxLength":512},"description":{"oneOf":[{"type":"string","maxLength":512},{"type":"object","additionalProperties":{"type":"string","maxLength":512}}]},"displayName":{"oneOf":[{"type":"string","maxLength":512},{"type":"object","additionalProperties":{"type":"string","maxLength":512}}]}}},"CommandRequest":{"type":"object","required":["name","schema"],"properties":{"@type":{"type":"string","const":"CommandRequest"},"@id":{"type":"string","pattern":"^dtmi:[A-Za-z](?:[A-Za-z0-9_]*[A-Za-z0-9])?(?::[A-Za-z](?:[A-Za-z0-9_]*[A-Za-z0-9])?)*(?:;[1-9][0-9]{0,8}(?:\\.[1-9][0-9]{0,5})?)?$","maxLength":2048},"name":{"type":"string","pattern":"^[a-zA-Z]\\w*$","maxLength":512},"schema":{"$ref":"#/definitions/Schema"},"nullable":{"type":"boolean"},"comment":{"type":"string","maxLength":512},"description":{"oneOf":[{"type":"string","maxLength":512},{"type":"object","additionalProperties":{"type":"string","maxLength":512}}]},"displayName":{"oneOf":[{"type":"string","maxLength":512},{"type":"object","additionalProperties":{"type":"string","maxLength":512}}]}}},"CommandResponse":{"type":"object","required":["name","schema"],"properties":{"@type":{"type":"string","const":"CommandResponse"},"@id":{"type":"string","pattern":"^dtmi:[A-Za-z](?:[A-Za-z0-9_]*[A-Za-z0-9])?(?::[A-Za-z](?:[A-Za-z0-9_]*[A-Za-z0-9])?)*(?:;[1-9][0-9]{0,8}(?:\\.[1-9][0-9]{0,5})?)?$","maxLength":2048},"name":{"type":"string","pattern":"^[a-zA-Z]\\w*$","maxLength":512},"schema":{"$ref":"#/definitions/Schema"},"nullable":{"type":"boolean"},"comment":{"type":"string","maxLength":512},"description":{"oneOf":[{"type":"string","maxLength":512},{"type":"object","additionalProperties":{"type":"string","maxLength":512}}]},"displayName":{"oneOf":[{"type":"string","maxLength":512},{"type":"object","additionalProperties":{"type":"string","maxLength":512}}]}}},"Schema":{"oneOf":[{"type":"string","enum":["boolean","date","dateTime","double","duration","float","integer","long","string","time","byte","bytes","decimal","short","unsignedByte","unsignedInteger","unsignedLong","unsignedShort","uuid","lineString","multiLineString","multiPoint","multiPolygon","point","polygon","scaledDecimal"]},{"type":"string","pattern":"^dtmi:[A-Za-z](?:[A-Za-z0-9_]*[A-Za-z0-9])?(?::[A-Za-z](?:[A-Za-z0-9_]*[A-Za-z0-9])?)*(?:;[1-9][0-9]{0,8}(?:\\.[1-9][0-9]{0,5})?)?$"},{"$ref":"#/definitions/ArraySchema"},{"$ref":"#/definitions/EnumSchema"},{"$ref":"#/definitions/MapSchema"},{"$ref":"#/definitions/ObjectSchema"}]},"ArraySchema":{"type":"object","required":["@type","elementSchema"],"properties":{"@id":{"type":"string","pattern":"^dtmi:[A-Za-z](?:[A-Za-z0-9_]*[A-Za-z0-9])?(?::[A-Za-z](?:[A-Za-z0-9_]*[A-Za-z0-9])?)*(?:;[1-9][0-9]{0,8}(?:\\.[1-9][0-9]{0,5})?)?$","maxLength":2048},"@type":{"type":"string","const":"Array"},"elementSchema":{"$ref":"#/definitions/Schema"},"comment":{"type":"string","maxLength":512},"description":{"oneOf":[{"type":"string","maxLength":512},{"type":"object","additionalProperties":{"type":"string","maxLength":512}}]},"displayName":{"oneOf":[{"type":"string","maxLength":512},{"type":"object","additionalProperties":{"type":"string","maxLength":512}}]}}},"EnumSchema":{"type":"object","required":["@type","valueSchema"],"properties":{"@id":{"type":"string","pattern":"^dtmi:[A-Za-z](?:[A-Za-z0-9_]*[A-Za-z0-9])?(?::[A-Za-z](?:[A-Za-z0-9_]*[A-Za-z0-9])?)*(?:;[1-9][0-9]{0,8}(?:\\.[1-9][0-9]{0,5})?)?$","maxLength":2048},"@type":{"type":"string","const":"Enum"},"valueSchema":{"type":"string","enum":["integer","string"]},"enumValues":{"type":"array","items":{"$ref":"#/definitions/EnumValue"}},"comment":{"type":"string","maxLength":512},"description":{"oneOf":[{"type":"string","maxLength":512},{"type":"object","additionalProperties":{"type":"string","maxLength":512}}]},"displayName":{"oneOf":[{"type":"string","maxLength":512},{"type":"object","additionalProperties":{"type":"string","maxLength":512}}]}}},"EnumValue":{"type":"object","required":["name","enumValue"],"properties":{"@type":{"type":"string","const":"EnumValue"},"@id":{"type":"string","pattern":"^dtmi:[A-Za-z](?:[A-Za-z0-9_]*[A-Za-z0-9])?(?::[A-Za-z](?:[A-Za-z0-9_]*[A-Za-z0-9])?)*(?:;[1-9][0-9]{0,8}(?:\\.[1-9][0-9]{0,5})?)?$","maxLength":2048},"name":{"type":"string","pattern":"^[a-zA-Z]\\w*$","maxLength":512},"enumValue":{"oneOf":[{"type":"integer"},{"type":"string"}]},"comment":{"type":"string","maxLength":512},"description":{"oneOf":[{"type":"string","maxLength":512},{"type":"object","additionalProperties":{"type":"string","maxLength":512}}]},"displayName":{"oneOf":[{"type":"string","maxLength":512},{"type":"object","additionalProperties":{"type":"string","maxLength":512}}]}}},"MapSchema":{"type":"object","required":["@type","mapKey","mapValue"],"properties":{"@id":{"type":"string","pattern":"^dtmi:[A-Za-z](?:[A-Za-z0-9_]*[A-Za-z0-9])?(?::[A-Za-z](?:[A-Za-z0-9_]*[A-Za-z0-9])?)*(?:;[1-9][0-9]{0,8}(?:\\.[1-9][0-9]{0,5})?)?$","maxLength":2048},"@type":{"type":"string","const":"Map"},"mapKey":{"$ref":"#/definitions/MapKey"},"mapValue":{"$ref":"#/definitions/MapValue"},"comment":{"type":"string","maxLength":512},"description":{"oneOf":[{"type":"string","maxLength":512},{"type":"object","additionalProperties":{"type":"string","maxLength":512}}]},"displayName":{"oneOf":[{"type":"string","maxLength":512},{"type":"object","additionalProperties":{"type":"string","maxLength":512}}]}}},"MapKey":{"type":"object","required":["name","schema"],"properties":{"@type":{"type":"string","const":"MapKey"},"@id":{"type":"string","pattern":"^dtmi:[A-Za-z](?:[A-Za-z0-9_]*[A-Za-z0-9])?(?::[A-Za-z](?:[A-Za-z0-9_]*[A-Za-z0-9])?)*(?:;[1-9][0-9]{0,8}(?:\\.[1-9][0-9]{0,5})?)?$","maxLength":2048},"name":{"type":"string","pattern":"^[a-zA-Z]\\w*$","maxLength":512},"schema":{"type":"string","const":"string"},"comment":{"type":"string","maxLength":512},"description":{"oneOf":[{"type":"string","maxLength":512},{"type":"object","additionalProperties":{"type":"string","maxLength":512}}]},"displayName":{"oneOf":[{"type":"string","maxLength":512},{"type":"object","additionalProperties":{"type":"string","maxLength":512}}]}}},"MapValue":{"type":"object","required":["name","schema"],"properties":{"@type":{"type":"string","const":"MapValue"},"@id":{"type":"string","pattern":"^dtmi:[A-Za-z](?:[A-Za-z0-9_]*[A-Za-z0-9])?(?::[A-Za-z](?:[A-Za-z0-9_]*[A-Za-z0-9])?)*(?:;[1-9][0-9]{0,8}(?:\\.[1-9][0-9]{0,5})?)?$","maxLength":2048},"name":{"type":"string","pattern":"^[a-zA-Z]\\w*$","maxLength":512},"schema":{"$ref":"#/definitions/Schema"},"comment":{"type":"string","maxLength":512},"description":{"oneOf":[{"type":"string","maxLength":512},{"type":"object","additionalProperties":{"type":"string","maxLength":512}}]},"displayName":{"oneOf":[{"type":"string","maxLength":512},{"type":"object","additionalProperties":{"type":"string","maxLength":512}}]}}},"ObjectSchema":{"type":"object","required":["@type"],"properties":{"@id":{"type":"string","pattern":"^dtmi:[A-Za-z](?:[A-Za-z0-9_]*[A-Za-z0-9])?(?::[A-Za-z](?:[A-Za-z0-9_]*[A-Za-z0-9])?)*(?:;[1-9][0-9]{0,8}(?:\\.[1-9][0-9]{0,5})?)?$","maxLength":2048},"@type":{"type":"string","const":"Object"},"fields":{"type":"array","items":{"$ref":"#/definitions/Field"}},"comment":{"type":"string","maxLength":512},"description":{"oneOf":[{"type":"string","maxLength":512},{"type":"object","additionalProperties":{"type":"string","maxLength":512}}]},"displayName":{"oneOf":[{"type":"string","maxLength":512},{"type":"object","additionalProperties":{"type":"string","maxLength":512}}]}}},"Field":{"type":"object","required":["name","schema"],"properties":{"@type":{"type":"string","const":"Field"},"@id":{"type":"string","pattern":"^dtmi:[A-Za-z](?:[A-Za-z0-9_]*[A-Za-z0-9])?(?::[A-Za-z](?:[A-Za-z0-9_]*[A-Za-z0-9])?)*(?:;[1-9][0-9]{0,8}(?:\\.[1-9][0-9]{0,5})?)?$","maxLength":2048},"name":{"type":"string","pattern":"^[a-zA-Z]\\w*$","maxLength":512},"schema":{"$ref":"#/definitions/Schema"},"comment":{"type":"string","maxLength":512},"description":{"oneOf":[{"type":"string","maxLength":512},{"type":"object","additionalProperties":{"type":"string","maxLength":512}}]},"displayName":{"oneOf":[{"type":"string","maxLength":512},{"type":"object","additionalProperties":{"type":"string","maxLength":512}}]}}}}}