[
	{
		"@id": "dtmi:agriculture:vineyard:VineyardProperty;1",
		"@type": "Interface",
		"@context": "dtmi:dtdl:context;4",
		"displayName": "Vineyard Property",
		"description": "Represents the entire wine property with multiple vineyard plots",
		"contents": [
			{
				"@type": "Property",
				"name": "name",
				"schema": "string",
				"description": "Name of the wine property",
				"writable": true
			},
			{
				"@type": "Property",
				"name": "owner",
				"schema": "string",
				"description": "Owner of the wine business",
				"writable": true
			},
			{
				"@type": "Property",
				"name": "totalArea",
				"schema": "double",
				"description": "Total area of the property in hectares",
				"writable": true,
				"unit": {
					"@type": "Unit",
					"symbol": "ha",
					"name": "hectare"
				},
				"semiotics": {
					"@type": "Semantic",
					"type": "area"
				}
			},
			{
				"@type": "Property",
				"name": "elevation",
				"schema": "double",
				"description": "Average elevation of the property",
				"writable": true,
				"unit": {
					"@type": "Unit",
					"symbol": "m",
					"name": "metre"
				},
				"semiotics": {
					"@type": "Semantic",
					"type": "height"
				}
			},
			{
				"@type": "Property",
				"name": "location",
				"schema": {
					"@type": "Object",
					"fields": [
						{
							"name": "latitude",
							"schema": "double"
						},
						{
							"name": "longitude",
							"schema": "double"
						}
					]
				},
				"description": "Geographic coordinates of the property",
				"writable": true
			},
			{
				"@type": "Relationship",
				"name": "hasVineyardPlots",
				"target": "dtmi:agriculture:vineyard:VineyardPlot;1",
				"maxMultiplicity": 100,
				"description": "Vineyard plots within the property",
				"writable": true
			},
			{
				"@type": "Relationship",
				"name": "hasWeatherStation",
				"target": "dtmi:agriculture:vineyard:WeatherStation;1",
				"maxMultiplicity": 1,
				"description": "Main weather station of the property",
				"writable": true
			},
			{
				"@type": "Relationship",
				"name": "hasWinery",
				"target": "dtmi:agriculture:vineyard:Winery;1",
				"maxMultiplicity": 1,
				"description": "Winery associated with the property",
				"writable": true
			}
		]
	},

	{
		"@id": "dtmi:agriculture:vineyard:PestTrap;1",
		"@type": "Interface",
		"@context": "dtmi:dtdl:context;4",
		"displayName": "Pest Trap",
		"description": "Represents a smart pest trap for monitoring insect activity",
		"contents": [
			{
				"@type": "Property",
				"name": "trapId",
				"schema": "string",
				"description": "Unique identifier of the trap",
				"writable": false
			},
			{
				"@type": "Property",
				"name": "targetPest",
				"schema": "string",
				"description": "Type of pest this trap is designed to catch",
				"writable": true
			},
			{
				"@type": "Property",
				"name": "installationDate",
				"schema": "dateTime",
				"description": "Date when the trap was installed",
				"writable": true
			},
			{
				"@type": "Property",
				"name": "batteryLevel",
				"schema": "double",
				"description": "Current battery level of the trap",
				"writable": false
			},
			{
				"@type": "Relationship",
				"name": "installedIn",
				"target": "dtmi:agriculture:vineyard:VineyardPlot;1",
				"maxMultiplicity": 1,
				"description": "Vineyard plot where the trap is installed",
				"writable": true
			},
			{
				"@type": "Telemetry",
				"name": "pestCount",
				"schema": "integer",
				"description": "Number of pests caught"
			},
			{
				"@type": "Telemetry",
				"name": "lastCaptureTime",
				"schema": "dateTime",
				"description": "Timestamp of the last pest capture"
			},
			{
				"@type": "Command",
				"name": "resetCount",
				"description": "Reset the pest count to zero"
			},
			{
				"@type": "Command",
				"name": "captureImage",
				"description": "Capture an image of the trap contents",
				"response": {
					"name": "result",
					"schema": {
						"@type": "Object",
						"fields": [
							{
								"name": "success",
								"schema": "boolean"
							},
							{
								"name": "imageId",
								"schema": "string"
							}
						]
					}
				}
			}
		]
	},

	{
		"@id": "dtmi:agriculture:vineyard:SoilMoistureSensor;1",
		"@type": "Interface",
		"@context": "dtmi:dtdl:context;4",
		"displayName": "Soil Moisture Sensor",
		"description": "Represents a smart soil moisture and nutrient sensor for vineyard monitoring",
		"contents": [
			{
				"@type": "Property",
				"name": "sensorId",
				"schema": "string",
				"description": "Unique identifier of the soil sensor",
				"writable": false
			},
			{
				"@type": "Property",
				"name": "installationDepth",
				"schema": "double",
				"description": "Depth at which the sensor is installed",
				"writable": true,
				"unit": {
					"@type": "Unit",
					"symbol": "cm",
					"name": "centimeter"
				}
			},
			{
				"@type": "Property",
				"name": "installationDate",
				"schema": "dateTime",
				"description": "Date when the sensor was installed",
				"writable": true
			},
			{
				"@type": "Property",
				"name": "batteryLevel",
				"schema": "double",
				"description": "Current battery level of the sensor",
				"writable": false,
				"unit": {
					"@type": "Unit",
					"symbol": "%",
					"name": "percentage"
				}
			},
			{
				"@type": "Relationship",
				"name": "installedIn",
				"target": "dtmi:agriculture:vineyard:VineyardPlot;1",
				"maxMultiplicity": 1,
				"description": "Vineyard plot where the sensor is installed",
				"writable": true
			},
			{
				"@type": "Telemetry",
				"name": "soilMoisture",
				"schema": "double",
				"description": "Current soil moisture level",
				"unit": {
					"@type": "Unit",
					"symbol": "%",
					"name": "percentage"
				}
			},
			{
				"@type": "Telemetry",
				"name": "soilTemperature",
				"schema": "double",
				"description": "Current soil temperature",
				"unit": {
					"@type": "Unit",
					"symbol": "Â°C",
					"name": "celsius"
				}
			},
			{
				"@type": "Telemetry",
				"name": "nitrogenLevel",
				"schema": "double",
				"description": "Current nitrogen level in soil",
				"unit": {
					"@type": "Unit",
					"symbol": "ppm",
					"name": "parts per million"
				}
			},
			{
				"@type": "Telemetry",
				"name": "pHLevel",
				"schema": "double",
				"description": "Current pH level of soil"
			},
			{
				"@type": "Command",
				"name": "calibrate",
				"description": "Calibrate the soil moisture sensor"
			},
			{
				"@type": "Command",
				"name": "setSamplingRate",
				"description": "Set the frequency of readings",
				"request": {
					"name": "rate",
					"schema": "integer",
					"description": "Sampling rate in minutes"
				}
			}
		]
	},

	{
		"@id": "dtmi:agriculture:vineyard:IrrigationController;1",
		"@type": "Interface",
		"@context": "dtmi:dtdl:context;4",
		"displayName": "Irrigation Controller",
		"description": "Represents a smart irrigation system for vineyard plots",
		"contents": [
			{
				"@type": "Property",
				"name": "controllerId",
				"schema": "string",
				"description": "Unique identifier of the irrigation controller",
				"writable": false
			},
			{
				"@type": "Property",
				"name": "model",
				"schema": "string",
				"description": "Model of the irrigation controller",
				"writable": true
			},
			{
				"@type": "Property",
				"name": "installationDate",
				"schema": "dateTime",
				"description": "Date when the controller was installed",
				"writable": true
			},
			{
				"@type": "Property",
				"name": "waterSource",
				"schema": "string",
				"description": "Source of water for irrigation",
				"writable": true
			},
			{
				"@type": "Property",
				"name": "operatingStatus",
				"schema": {
					"@type": "Enum",
					"valueSchema": "string",
					"enumValues": [
						{
							"name": "operational",
							"displayName": "Operational",
							"enumValue": "operational"
						},
						{
							"name": "maintenance",
							"displayName": "Under Maintenance",
							"enumValue": "maintenance"
						},
						{
							"name": "error",
							"displayName": "Error",
							"enumValue": "error"
						},
						{
							"name": "disabled",
							"displayName": "Disabled",
							"enumValue": "disabled"
						}
					]
				},
				"description": "Current operational status of the controller",
				"writable": true
			},
			{
				"@type": "Relationship",
				"name": "controlsPlot",
				"target": "dtmi:agriculture:vineyard:VineyardPlot;1",
				"maxMultiplicity": 10,
				"description": "Vineyard plots controlled by this irrigation system",
				"writable": true
			},
			{
				"@type": "Relationship",
				"name": "connectedSensors",
				"target": "dtmi:agriculture:vineyard:SoilMoistureSensor;1",
				"maxMultiplicity": 20,
				"description": "Soil moisture sensors connected to this controller",
				"writable": true
			},
			{
				"@type": "Telemetry",
				"name": "waterFlow",
				"schema": "double",
				"description": "Current water flow rate",
				"unit": {
					"@type": "Unit",
					"symbol": "L/min",
					"name": "liters per minute"
				}
			},
			{
				"@type": "Telemetry",
				"name": "totalWaterUsed",
				"schema": "double",
				"description": "Total water used in current cycle",
				"unit": {
					"@type": "Unit",
					"symbol": "L",
					"name": "liters"
				}
			},
			{
				"@type": "Telemetry",
				"name": "lastIrrigationTime",
				"schema": "dateTime",
				"description": "Time of last irrigation"
			},
			{
				"@type": "Command",
				"name": "startIrrigation",
				"description": "Start irrigation cycle",
				"request": {
					"name": "duration",
					"schema": "integer",
					"description": "Duration in minutes"
				}
			},
			{
				"@type": "Command",
				"name": "stopIrrigation",
				"description": "Stop the current irrigation cycle"
			},
			{
				"@type": "Command",
				"name": "scheduleIrrigation",
				"description": "Schedule a future irrigation",
				"request": {